{
  "id": "cau-1",
  "type": "single_choice",
  "points": 1,
  "difficulty": "easy",
  "content": {
    "blocks": [
      {
        "type": "paragraph",
        "content": [
          {
            "text": "Phân số nào bằng 1/2?"
          }
        ]
      }
    ]
  },
  "options": [
    {
      "id": "a",
      "content": {
        "blocks": [
          {
            "type": "paragraph",
            "content": [
              {
                "text": "1/3"
              }
            ]
          }
        ]
      }
    },
    {
      "id": "b",
      "content": {
        "blocks": [
          {
            "type": "paragraph",
            "content": [
              {
                "text": "2/4"
              }
            ]
          }
        ]
      }
    },
    {
      "id": "c",
      "content": {
        "blocks": [
          {
            "type": "paragraph",
            "content": [
              {
                "text": "3/4"
              }
            ]
          }
        ]
      }
    },
    {
      "id": "d",
      "content": {
        "blocks": [
          {
            "type": "paragraph",
            "content": [
              {
                "text": "2/3"
              }
            ]
          }
        ]
      }
    }
  ],
  "correctAnswer": "b",
  "explanation": {
    "blocks": [
      {
        "type": "paragraph",
        "content": [
          {
            "text": "Chia cả tử số và mẫu số của 2/4 cho 2 được 1/2."
          }
        ]
      }
    ]
  }
}
